<!--Carl de Witt u21444928-->


<!-- game -->
<!ELEMENT game ((game, result) | ((rps) | (rpsls)))>
<!ATTLIST game icon CDATA #IMPLIED>
<!ELEMENT rps (rock|paper|scissors)>
<!ELEMENT rock EMPTY>
<!ELEMENT paper EMPTY>
<!ELEMENT scissors EMPTY>
<!ELEMENT lizard EMPTY>
<!ELEMENT spock EMPTY>
<!ATTLIST rps game_id CDATA #IMPLIED>
<!ELEMENT rpsls (rock|paper|scissors|lizard|spock)>
<!ATTLIST rpsls game_id CDATA #IMPLIED>
<!ELEMENT result (status)*>
<!ELEMENT status (#PCDATA)>
<!ATTLIST status game_id CDATA #REQUIRED>

<!ATTLIST rock beat CDATA #IMPLIED>
<!ATTLIST paper beat CDATA #IMPLIED>
<!ATTLIST scissors beat CDATA #IMPLIED>
<!ATTLIST lizard beat CDATA #IMPLIED>
<!ATTLIST spock beat CDATA #IMPLIED>